{
  "schema_version": "1.0",
  "kind": "submission",
  "task_id": "WP-00",
  "candidate_revision": "c95d01162fb6fc7fe0a669cf213bdd73813eb7a8",
  "summary": "Author-side WP-00 submission evidence for the independently approved candidate under fence 1.",
  "changed_paths": [
    ".gitignore",
    "docs/qualification/README.md",
    "docs/qualification/model-qualification-verification.md",
    "docs/qualification/model-roster.evidence.json",
    "docs/qualification/probes/gpt-5.6-luna.json",
    "docs/qualification/probes/gpt-5.6-sol.json",
    "docs/qualification/probes/gpt-5.6-terra.json",
    "docs/qualification/probes/gpt-6-astra.json",
    "docs/qualification/runtime-inventory.json"
  ],
  "checks": [
    {
      "id": "author-verification-log",
      "required": true,
      "status": "PASS",
      "command_or_procedure": "Review the recorded JSON parsing, roster-hash, package-validation, harness, and exact-range whitespace-check outcomes.",
      "evidence_path": "docs/qualification/evidence/wp00-author-verification.log",
      "sha256": "a72379baa97571d3cfef4b753a3e34e809e221fffa627c7444c1adcbf70eaf82"
    },
    {
      "id": "runtime-inventory",
      "required": true,
      "status": "PASS",
      "command_or_procedure": "Verify the sanitized runtime inventory SHA-256 against this submission envelope.",
      "evidence_path": "docs/qualification/runtime-inventory.json",
      "sha256": "9a7615dbec54b796c01274315c7d345253d8a639bdfaa42d41fb425a8f39e049"
    },
    {
      "id": "model-roster",
      "required": true,
      "status": "PASS",
      "command_or_procedure": "Verify the active roster evidence SHA-256 against this submission envelope.",
      "evidence_path": "docs/qualification/model-roster.evidence.json",
      "sha256": "2c1faf1e067e31615111b2821d687c269524390c11f1dac7c504f9fa60a84e17"
    },
    {
      "id": "model-qualification-verification",
      "required": true,
      "status": "PASS",
      "command_or_procedure": "Verify the independent model-qualification verification record SHA-256 against this submission envelope.",
      "evidence_path": "docs/qualification/model-qualification-verification.md",
      "sha256": "418a84f629b8751dc22e5131ebd2fa69d88fadb86b10a3f6c80d63055373791c"
    },
    {
      "id": "tier-1-probe",
      "required": true,
      "status": "PASS",
      "command_or_procedure": "Verify the Tier 1 gpt-6-astra bounded probe SHA-256 against this submission envelope.",
      "evidence_path": "docs/qualification/probes/gpt-6-astra.json",
      "sha256": "6ab0d7b121630937de88441c1aedf1e46de1da1d0319ac01806bb7435fdf726f"
    },
    {
      "id": "tier-1-fallback-probe",
      "required": true,
      "status": "PASS",
      "command_or_procedure": "Verify the Tier 1 fallback gpt-5.6-sol bounded probe SHA-256 against this submission envelope.",
      "evidence_path": "docs/qualification/probes/gpt-5.6-sol.json",
      "sha256": "b3517e156c382bc9fb45ed29994a8ff573854ddcd03436fee88ed053810ae300"
    },
    {
      "id": "tier-2-probe",
      "required": true,
      "status": "PASS",
      "command_or_procedure": "Verify the Tier 2 gpt-5.6-terra bounded probe SHA-256 against this submission envelope.",
      "evidence_path": "docs/qualification/probes/gpt-5.6-terra.json",
      "sha256": "1c81e33c60d7da2e23b1d9f4fc1c8e8647bb26dfce3ff9fcce6dc3d1d19aeda3"
    },
    {
      "id": "tier-3-probe",
      "required": true,
      "status": "PASS",
      "command_or_procedure": "Verify the Tier 3 gpt-5.6-luna bounded probe SHA-256 against this submission envelope.",
      "evidence_path": "docs/qualification/probes/gpt-5.6-luna.json",
      "sha256": "469723e6801d3a2c91d29d52ca3ed69c4bcdc6206d7a85cceb12c472b08ab00f"
    }
  ],
  "runtime_stopped": true,
  "notes": "Fence 1. This author-side packet is deliberately uncommitted for Astra to bind; it does not constitute a harness submission or clear any product or external gate."
}
